{
  "metadata": {
    "title": "Architecture Patterns with Python",
    "source_file": "Architecture Patterns with Python_metadata.json"
  },
  "chapters": [
    {
      "chapter_number": 3,
      "title": "specifically discusses some general heuristics for choosing",
      "start_page": 36,
      "end_page": 40,
      "summary": "abstractions.\nEncapsulation and abstraction help us by hiding details and protecting\nmodule, or object uses another, we say that the one depends on the\nOne of the most common examples is the three-layered architecture\nLayered architecture\ninterface components communicate with a business logic layer that\n1. High-level modules should not depend on low-level modules.\nBoth should depend on abstractions.\n2. Abstractions should not depend on details.\nshould depend on abstractions.\nHigh-level modules are the code that your organization really cares\nhigh-level modules of a software system are the functions, classes, and\nBy contrast, low-level modules are the code that your organization\nAll they care about is whether the high-level concepts work correctly.\ndepend on technical details; instead, both should use abstractions.\nHigh-level modules should be easy to\nchange in response to business needs.\nLow-level modules (details) are\nchange your infrastructure details when you need to (think about\nsharding a database, for example), without needing to make changes to\nyour business layer.\nHow can we have an abstraction that\ndoesn’t depend on the details it’s abstracting?\nneed to talk more about that middle layer: the high-level modules or\nwrong is that business logic becomes spread throughout the layers of",
      "keywords": [
        "abstractions",
        "High-level modules",
        "business",
        "modules",
        "details",
        "depend",
        "business logic",
        "change",
        "code",
        "DIP",
        "High-level",
        "easier to maintain",
        "n’t",
        "powerful tool",
        "low-level modules"
      ],
      "concepts": [
        "layering",
        "layers",
        "module",
        "business",
        "abstractions",
        "abstract",
        "abstraction",
        "details",
        "level",
        "interface"
      ],
      "similar_chapters": [
        {
          "book": "Architecture Patterns with Python",
          "chapter": 7,
          "title": "",
          "score": 0.519,
          "base_score": 0.369,
          "topic_boost": 0.15,
          "method": "sbert"
        },
        {
          "book": "Architecture Patterns with Python",
          "chapter": 1,
          "title": "",
          "score": 0.499,
          "base_score": 0.349,
          "topic_boost": 0.15,
          "method": "sbert"
        },
        {
          "book": "Architecture Patterns with Python",
          "chapter": 4,
          "title": "",
          "score": 0.315,
          "base_score": 0.315,
          "topic_boost": 0.0,
          "method": "sbert"
        }
      ],
      "enriched_keywords": {
        "tfidf": [
          "modules",
          "level modules",
          "level",
          "high level",
          "details"
        ],
        "semantic": [],
        "merged": [
          "modules",
          "level modules",
          "level",
          "high level",
          "details"
        ]
      },
      "topic_id": 1,
      "chapter_provenance": {
        "methods_used": [
          "sbert",
          "tfidf",
          "bertopic"
        ],
        "sbert_score": 0.29130909641659486,
        "topic_boost": 0.15,
        "timestamp": "2025-12-17T23:01:03.584574+00:00"
      }
    },
    {
      "chapter_number": 1,
      "title": "shows how to build a business layer with a Domain Model",
      "start_page": 41,
      "end_page": 69,
      "summary": "Chapter 1 shows how to build a business layer with a Domain Model\ndomain model easy to change and free of low-level concerns by\nDomain Modeling\nMost developers have never seen a domain model, only a data\nmodel.\nThe first part of the book looks at how to build a rich object model\nDomain Modeling\nThis chapter looks into how we can model business processes with\ndomain modeling matters, and we’ll look at a few key patterns for\nmodeling domains: Entity, Value Object, and Domain Service.\nFigure 1-1 is a simple visual placeholder for our Domain Model\nother chapters, we’ll build things around the domain model, but you\nDomain Model\nA placeholder illustration of our domain model\nWhat Is a Domain Model?\nbook, we’re going to use the term domain model instead.\nbecause you have a model of the way objects move in space.\nThe domain model is the mental map that business owners have of\nDomain-driven design, or DDD, popularized the concept of domain modeling,  and it’s been a\ncore business domain.\nIf we get that model right, our software delivers value and makes new things\nshow the basics of building a domain model, and building an architecture around it that leaves\ndomain model.\ndomain model, where complex ideas and processes are boiled down\nWe’re going to use a real-world domain model throughout this book,\nallocating stock to a customer’s orders; see Figure 1-2.\nTime for some domain modeling.\nUnderstanding the domain model takes time, and patience, and Post-it\ndomain model.\nwhile having a conversation with our domain experts about allocation.\norder lines, where each line has a SKU and a quantity.\nWe need to allocate order lines to batches.\nWhen we’ve allocated an order line to a batch, we will\nof stock to a batch, the available quantity is reduced by x.\nWe have a batch of 20 SMALL-TABLE, and we allocate an order line for 2 SMALL-TABLE.\nWe can’t allocate to a batch if the available quantity is less than the quantity of the order line.\nWe have a batch of 1 BLUE-CUSHION, and an order line for 2 BLUE-CUSHION.\nWe should not be able to allocate the line to the batch.\nWe have a batch of 10 BLUE-VASE, and we allocate an order line for 2 BLUE-VASE.\nIf we allocate the order line again to the same batch, the batch should still have an\nallocate to warehouse stock in preference to shipment batches.\nWe allocate to shipment batches\nUnit Testing Domain Models\nwant to show you how we would construct a model from this business\nA first test for allocation (test_batches.py)\ndef test_allocating_to_a_batch_reduces_the_available_quantity(): \nbatch.allocate(line) \nassert batch.available_quantity == 18\nAnd here is a domain model that meets our requirements:\nFirst cut of a domain model for batches (model.py)\ndef allocate(self, line: OrderLine):\nself.available_quantity -= line.qty  \nin its branch (e.g., chapter_01_domain_model).\nFor domain models, they can sometimes help to clarify or\navailable_quantity, and we decrement that value on allocation.\nanother, but we think that modeling our domain precisely will pay off.\nTesting logic for what we can allocate (test_batches.py)\ndef make_batch_and_line(sku, batch_qty, line_qty): \nOrderLine(\"order-123\", sku, line_qty) \ndef test_can_allocate_if_available_greater_than_required(): \nlarge_batch, small_line = make_batch_and_line(\"ELEGANT-LAMP\", 20, 2) \nassert large_batch.can_allocate(small_line) \ndef test_cannot_allocate_if_available_smaller_than_required(): \nsmall_batch, large_line = make_batch_and_line(\"ELEGANT-LAMP\", 2, 20) \nassert small_batch.can_allocate(large_line) is False \ndef test_can_allocate_if_available_equal_to_required(): \nassert batch.can_allocate(line) \ndef test_cannot_allocate_if_skus_do_not_match(): \nassert batch.can_allocate(different_sku_line) is False\nthat we don’t keep repeating the same lines of code to create a batch\ncan_allocate method of Batch:\ndef can_allocate(self, line: OrderLine) -> bool: \nreturn self.sku == line.sku and self.available_quantity >= line.qty\nThis test is going to require a smarter model (test_batches.py)\ndef test_can_only_deallocate_allocated_lines(): \nbatch.deallocate(unallocated_line) \nassert batch.available_quantity == 20\nIn this test, we’re asserting that deallocating a line from a batch has no\neffect unless the batch previously allocated the line.\nour Batch needs to understand which lines have been allocated.\nThe domain model now tracks allocations (model.py)\nself._allocations = set()  # type: Set[OrderLine] \ndef allocate(self, line: OrderLine): \nif self.can_allocate(line): \nself._allocations.add(line) \ndef deallocate(self, line: OrderLine): \nif line in self._allocations: \nself._allocations.remove(line) \ndef allocated_quantity(self) -> int: \nreturn sum(line.qty for line in self._allocations) \ndef can_allocate(self, line: OrderLine) -> bool: \nreturn self.sku == line.sku and self.available_quantity >= line.qty\nallocated OrderLine objects.\nLast batch test!\n(test_batches.py)\ndef test_allocation_is_idempotent(): \nbatch.allocate(line) \nbatch.allocate(line) \nassert batch.available_quantity == 18\nmodel is too trivial to bother with DDD (or even object orientation!).\nwe might not want to allocate them to the earliest batch.\nBut taking this simple domain model as a placeholder for something\nmore complex, we’re going to extend our simple domain model in the\ndef __init__(self, ref: Reference, sku: Sku, qty: Quantity): \neach line has a SKU and a quantity.\noften choose to represent it using the Value Object pattern.\nMore examples of value objects\nAn order line is uniquely identified by its order ID, SKU, and quantity;\nWhat about a batch,\nWe use the term entity to describe a domain object that has long-lived\nBatches, in our\nWe can allocate lines to a batch, or change the\nWe’ve made a model to represent batches, but what we actually need\nto do is allocate order lines against a specific set of batches that\norder line, given a set of batches, sounds a lot like a function, and we\nTesting our domain service (test_allocate.py)\ndef test_prefers_current_stock_batches_to_shipments(): \nallocate(line, [in_stock_batch, shipment_batch])